{
  "$id": "urn:pmorg:capability-disposition-post-disposition-test-manifest:v1",
  "$schema": "https://json-schema.org/draft/2020-12/schema",
  "additionalProperties": false,
  "properties": {
    "capability_id": {
      "const": "capability-disposition-qualification"
    },
    "execution": {
      "additionalProperties": false,
      "properties": {
        "framework": {
          "const": "python-unittest"
        },
        "mode": {
          "const": "single-process-complete-modules"
        },
        "suites": {
          "const": [
            "pmorg.tests.test_qualification_oracles",
            "pmorg.tests.test_qualification_signing"
          ]
        }
      },
      "required": [
        "framework",
        "mode",
        "suites"
      ],
      "type": "object"
    },
    "expected_test_count": {
      "const": 12
    },
    "implementation_bindings": {
      "items": {
        "additionalProperties": false,
        "properties": {
          "digest": {
            "pattern": "^sha256:[0-9a-f]{64}$",
            "type": "string"
          },
          "relative_path": {
            "minLength": 1,
            "type": "string"
          },
          "size_bytes": {
            "minimum": 1,
            "type": "integer"
          }
        },
        "required": [
          "digest",
          "relative_path",
          "size_bytes"
        ],
        "type": "object"
      },
      "maxItems": 2,
      "minItems": 2,
      "type": "array"
    },
    "implementation_path_set_hash": {
      "pattern": "^sha256:[0-9a-f]{64}$",
      "type": "string"
    },
    "patch_ledger_entry_ids": {
      "const": [
        "PL-046"
      ]
    },
    "patch_ledger_set_hash": {
      "pattern": "^sha256:[0-9a-f]{64}$",
      "type": "string"
    },
    "pmorg_platform_commit": {
      "const": "d3cb3ceee627024404af0588103168367c0f5faa"
    },
    "requirement_ids": {
      "const": [
        "A-PATCH-002",
        "A-PATCH-003",
        "A-PATCH-004",
        "A-PATCH-005",
        "A-PATCH-006",
        "PLT-006"
      ]
    },
    "runner": {
      "additionalProperties": false,
      "properties": {
        "digest": {
          "pattern": "^sha256:[0-9a-f]{64}$",
          "type": "string"
        },
        "relative_path": {
          "minLength": 1,
          "type": "string"
        },
        "size_bytes": {
          "minimum": 1,
          "type": "integer"
        }
      },
      "required": [
        "digest",
        "relative_path",
        "size_bytes"
      ],
      "type": "object"
    },
    "schema_version": {
      "const": "pmorg.capability-disposition-post-disposition-test-manifest/v1"
    },
    "test_cases": {
      "items": {
        "additionalProperties": false,
        "properties": {
          "fully_qualified_name": {
            "minLength": 1,
            "type": "string"
          },
          "test_id": {
            "minLength": 1,
            "type": "string"
          }
        },
        "required": [
          "fully_qualified_name",
          "test_id"
        ],
        "type": "object"
      },
      "maxItems": 12,
      "minItems": 12,
      "type": "array"
    },
    "test_module_bindings": {
      "items": {
        "additionalProperties": false,
        "properties": {
          "digest": {
            "pattern": "^sha256:[0-9a-f]{64}$",
            "type": "string"
          },
          "relative_path": {
            "minLength": 1,
            "type": "string"
          },
          "size_bytes": {
            "minimum": 1,
            "type": "integer"
          }
        },
        "required": [
          "digest",
          "relative_path",
          "size_bytes"
        ],
        "type": "object"
      },
      "maxItems": 2,
      "minItems": 2,
      "type": "array"
    }
  },
  "required": [
    "schema_version",
    "capability_id",
    "requirement_ids",
    "pmorg_platform_commit",
    "implementation_bindings",
    "implementation_path_set_hash",
    "test_module_bindings",
    "patch_ledger_entry_ids",
    "patch_ledger_set_hash",
    "runner",
    "execution",
    "test_cases",
    "expected_test_count"
  ],
  "type": "object"
}
